{
  "schemaVersion": 1,
  "catalogId": "tde-inspiration-bkvince",
  "status": "study",
  "source": {
    "name": "MOD_T.D.E.",
    "version": "3.1d",
    "archiveFile": "TDE_D2SE_3.1d.1.7z",
    "archiveSha256": "671D0636EF96FF59D94192C3FF0DD73AB69CAAE1D41FC4563F796149AFBC9356",
    "readmePath": "TDE_3.1d_Readme.docx",
    "paragraphCount": 2038,
    "tableCount": 91,
    "reviewedAt": "2026-07-31"
  },
  "method": {
    "scope": [
      "Reformulate documented gameplay ideas for BKVince instead of copying TDE implementation data.",
      "Use the 91 loose tables only as structural evidence.",
      "Consider data-only, native plugin, memory-patch, and hybrid routes.",
      "Exclude candidates that require new visual or audio assets."
    ],
    "scoringFormula": "playerValue*6 + bkvinceFit*5 + technicalConfidence*4 + isolation*3 + maintenance*2",
    "copyrightBoundary": "The catalog stores references, hashes, short reformulations, and credits; it does not reproduce TDE prose, tables, assets, or binaries.",
    "implementationBoundary": "This study changes no BKVince gameplay or runtime file. Every future native candidate requires its own incubation destination gate and governed 92777 evidence before implementation."
  },
  "coverage": {
    "readmeChunks": [
      { "start": 1, "end": 100, "sha256": "98951BC50DD61F8BBF355AE4B295FC4D82DBCA7041A705DA9B684FC9B85D80CF" },
      { "start": 101, "end": 200, "sha256": "CE46A8C9B13E30EC9FC9CEBD26986DFAEB85BAF327C01988882234C5FCB2473A" },
      { "start": 201, "end": 300, "sha256": "E931F923300149739709855A25DC809518D685743A86D56A1597B77D6B947784" },
      { "start": 301, "end": 400, "sha256": "3F45F20B22F4F7E6FF95F39EA4E6955CE813E6D4FB7EA14BA3A07014C77FE578" },
      { "start": 401, "end": 500, "sha256": "70BFC0FF314C2D1BCAF625A38D218D64F4FCE0B731BC62828E353DA1727605A4" },
      { "start": 501, "end": 600, "sha256": "3F064AD398C177B2E49CEF0A2F240207DCFEF96296723D49D40CB153CFB1EE64" },
      { "start": 601, "end": 700, "sha256": "663DB2FBEFD2624D0C75468049ED001EA37B1F721DC84B5A992B10815583CD56" },
      { "start": 701, "end": 800, "sha256": "9DE3746D9579A90602E68ACE9C7F28A62757511307E1DF3CCBA18440275668F2" },
      { "start": 801, "end": 900, "sha256": "1BBD4EA3E12FAA3F5D1CDF1A8E6E37D9217B19D22DA38817DA79D125F31601F9" },
      { "start": 901, "end": 1000, "sha256": "6DDE6851BC43A3F981E9252AE2A6404060429EF05F7D4C6AA55825A4620B4581" },
      { "start": 1001, "end": 1100, "sha256": "3C5E2A97BACAA79F3F58075A464D3D4C7052935F7D00BDA7BBD0603D1FAC1176" },
      { "start": 1101, "end": 1200, "sha256": "0F17A63ABCDE34ECC053CD51BE87331FD4323A4D4CE04E42561B09854A56C826" },
      { "start": 1201, "end": 1300, "sha256": "C6906325622664310F2497F0D1F5C4FD90B135D48ABAA48CDA23D9AE8BB1EF97" },
      { "start": 1301, "end": 1400, "sha256": "33A0C70A19642CBF13A49D5222F32F1586046E12AA7B5F00E34E6403F481AB37" },
      { "start": 1401, "end": 1500, "sha256": "0C84543118FFEF7640673EE56C5CCD9769719A4998F6C20D077B1F3963E1A806" },
      { "start": 1501, "end": 1600, "sha256": "A01FBD402D69A7DED09FA7FBC57F3119941C0D89B02EB1AF6B75B9354D3BDD46" },
      { "start": 1601, "end": 1700, "sha256": "56D1CA31ED56B0B896B0E24AE24F4BB2CC79DB08FAE130D27DBB53F76228D53F" },
      { "start": 1701, "end": 1800, "sha256": "F218A6F44402DD784252492742E01717803F52FA2C78B499F998AA9E8DD6561F" },
      { "start": 1801, "end": 1900, "sha256": "6F1ADCF239FA0BDCA92E20C3966D2F603A93C5F08B259A04065AE885C4D6D03E" },
      { "start": 1901, "end": 2000, "sha256": "8F93F27BC5BB59647CB10B031956DF6E5E9180DB9E7427FD9679F4CA381BCAB0" },
      { "start": 2001, "end": 2038, "sha256": "6C1C2071D0FB049E88CFC06F5BE75C8DFC03778481E6F80579B5974131A7F0A6" }
    ],
    "tables": {
      "files": [
        "aiparms.txt", "arena.txt", "armor.txt", "automagic.txt", "automap.txt", "belts.txt", "bodylocs.txt", "books.txt", "charstats.txt", "chartemplate.txt",
        "colors.txt", "compcode.txt", "composit.txt", "cubemain.txt", "cubemod.txt", "cubetype.txt", "difficultylevels.txt", "elemtypes.txt", "events.txt", "experience.txt",
        "gamble.txt", "gems.txt", "hiredesc.txt", "hireling.txt", "hitclass.txt", "inventory.txt", "itemratio.txt", "itemstatcost.txt", "itemtypes.txt", "levels.txt",
        "lowqualityitems.txt", "lvlmaze.txt", "lvlprest.txt", "lvlsub.txt", "lvltypes.txt", "lvlwarp.txt", "magicprefix.txt", "magicsuffix.txt", "misc.txt", "misscalc.txt",
        "missiles.txt", "monai.txt", "monequip.txt", "monitempercent.txt", "monlvl.txt", "monmode.txt", "monname.txt", "monplace.txt", "monpreset.txt", "monprop.txt",
        "monseq.txt", "monsounds.txt", "monstats.txt", "monstats2.txt", "montype.txt", "monumod.txt", "npc.txt", "objects.txt", "objgroup.txt", "objmode.txt",
        "objtype.txt", "overlay.txt", "pettype.txt", "playerclass.txt", "plrmode.txt", "plrtype.txt", "properties.txt", "qualityitems.txt", "rareprefix.txt", "raresuffix.txt",
        "runes.txt", "setitems.txt", "sets.txt", "shrines.txt", "skillcalc.txt", "skilldesc.txt", "skills.txt", "soundenviron.txt", "sounds.txt", "states.txt",
        "storepage.txt", "superuniques.txt", "treasureclass.txt", "treasureclassex.txt", "uniqueappellation.txt", "uniqueitems.txt", "uniqueprefix.txt", "uniquesuffix.txt", "uniquetitle.txt", "weaponclass.txt", "weapons.txt"
      ],
      "manifestSha256": "B7FC512541B1902AC800F88746E1A2176427EF77FD7B9CBC1ADE572D9DAC1B72",
      "allCrlf": true,
      "roundTripByteExact": true
    },
    "compatibilityAudit": {
      "commonTables": 81,
      "exactHeaders": 18,
      "schemaDifferences": 63,
      "tdeOnly": 10,
      "bkvinceOnly": 10
    }
  },
  "credits": [
    { "name": "Nagahaku", "role": "TDE document author metadata", "source": "TDE_3.1d_Readme.docx core properties" },
    { "name": "Kureharu Lonegirl", "role": "TDE document last-modified metadata", "source": "TDE_3.1d_Readme.docx core properties" },
    { "name": "The Phrozen Keep contributors, including Cypress", "role": "Upstream bug-fix ideas credited by TDE", "source": "readme:p5" },
    { "name": "RuffnecKk", "role": "BKVince adaptation study and governed catalog", "source": "Workspace RuffnecKk" }
  ],
  "entries": [
    {
      "id": "cube-preserve-socketables", "title": "Preserve socketables when clearing an item", "lane": "data", "domain": "cube",
      "playerEffect": "Let the player empty a socketed item while recovering the inserted components at an explicit high cost.",
      "sourceRefs": ["readme:p30", "readme:p1610"], "tableEvidence": ["cubemain.txt", "gems.txt"], "existingCoverage": [],
      "route": "data_only", "disposition": "shortlisted", "scores": { "playerValue": 5, "bkvinceFit": 5, "technicalConfidence": 5, "isolation": 5, "maintenance": 5, "priority": 100 },
      "effort": "low", "requiresNewAssets": false, "nativeProofStatus": "not_applicable", "futureDestinationGateRequired": false,
      "rationale": "High-value reversible recipe that can be designed against BKVince item economy without importing TDE rows.", "dependencies": ["BKVince cube economy review"]
    },
    {
      "id": "split-larger-gems", "title": "Split larger gems", "lane": "data", "domain": "cube",
      "playerEffect": "Convert one higher-grade gem into three gems of the preceding grade.",
      "sourceRefs": ["readme:p1611", "readme:p1612", "readme:p1952"], "tableEvidence": ["cubemain.txt", "gems.txt", "misc.txt"], "existingCoverage": ["gem-storage"],
      "route": "data_only", "disposition": "shortlisted", "scores": { "playerValue": 4, "bkvinceFit": 5, "technicalConfidence": 5, "isolation": 5, "maintenance": 5, "priority": 94 },
      "effort": "low", "requiresNewAssets": false, "nativeProofStatus": "not_applicable", "futureDestinationGateRequired": false,
      "rationale": "Complements the governed gem economy and is easy to make idempotent and testable.", "dependencies": ["Storage Bag and gem point-value compatibility"]
    },
    {
      "id": "rotate-charms", "title": "Rotate large and grand charms", "lane": "data", "domain": "cube",
      "playerEffect": "Offer alternate charm footprints through a cube conversion using existing item art and identities.",
      "sourceRefs": ["readme:p1613", "readme:p1614"], "tableEvidence": ["cubemain.txt", "misc.txt", "inventory.txt"], "existingCoverage": [],
      "route": "data_only", "disposition": "shortlisted", "scores": { "playerValue": 4, "bkvinceFit": 5, "technicalConfidence": 5, "isolation": 5, "maintenance": 4, "priority": 92 },
      "effort": "low", "requiresNewAssets": false, "nativeProofStatus": "not_applicable", "futureDestinationGateRequired": false,
      "rationale": "Adds inventory choices without changing serialization if separate BKVince base rows are used.", "dependencies": ["Inventory footprint and Storage Bag collision audit"]
    },
    {
      "id": "socket-drilling-floor", "title": "Guarantee a useful socket-drilling floor", "lane": "data", "domain": "cube",
      "playerEffect": "Make selected common-item socket recipes guarantee at least two sockets, with costly recipes allowed to reach three.",
      "sourceRefs": ["readme:p1623", "readme:p1643", "readme:p1652"], "tableEvidence": ["cubemain.txt", "armor.txt", "weapons.txt"], "existingCoverage": ["configurable-larzuk-sockets"],
      "route": "data_only", "disposition": "shortlisted", "scores": { "playerValue": 4, "bkvinceFit": 4, "technicalConfidence": 5, "isolation": 5, "maintenance": 4, "priority": 87 },
      "effort": "low", "requiresNewAssets": false, "nativeProofStatus": "not_applicable", "futureDestinationGateRequired": false,
      "rationale": "A cube-only variant avoids conflating the idea with the governed Larzuk service.", "dependencies": ["Socket cap and runeword economy audit"]
    },
    {
      "id": "difficulty-immunity-curve", "title": "Progress monster immunities by difficulty", "lane": "data", "domain": "monster",